Name,Category,AD-group,PS-Profile-old,PS-Profile-New,comment,USERCLAIM,IDEA,#
P2V Headoffice PP Power User,, ,profile.PP.Headoffice.Power,XXX.profile.PP.Headoffice.Power.OLD,,,,
P2V Access CASH system,ACCESS,dlg.WW.ADM-Services.P2V.access.CASH,-,-,access to old Palantir Cash (via Citrix),,,1
P2V Development System,ACCESS,dlg.WW.ADM-Services.P2V.access.development,-,-,access to P2V Development System (via Citrix),,,10
P2V NAMR Report Tool,ACCESS,dlg.WW.ADM-Services.P2V.access.NAMR,-,-,access to NAMR Reporting Tool (via Citrix),,,
P2V Production System,ACCESS,dlg.WW.ADM-Services.P2V.access.production,-,-,access to P2V Production System (via Citrix),,,449
P2V Test System,ACCESS,dlg.WW.ADM-Services.P2V.access.test,-,-,"access to P2V TEST System (via Citrix , multiple tenants)",,,427
P2V Training System,ACCESS,dlg.WW.ADM-Services.P2V.access.training,-,-,access to P2V TRAINING System (via Citrix),,,122
P2V Update System,ACCESS,dlg.WW.ADM-Services.P2V.access.update,-,-,access to P2V UPDATE System (via Citrix),,,24
P2V Administrator,PROFILE,dlg.WW.ADM-Services.P2V.Admin,Administrators,Administrators,Administrators,X,,4
P2V Approver,not in use,dlg.WW.ADM-Services.P2V.approver,,,,,,0
P2V Vendor,???,dlg.WW.ADM-Services.P2V.Aucerna,,,collector group for external consultants,,,10
P2V Auditor,PROFILE,dlg.WW.ADM-Services.P2V.auditor,Auditor,A12.profile.Auditor,Access Audit Logs,X,,6
P2V Business Development Key User,not in use,dlg.WW.ADM-Services.P2V.BD.key,,,,,,
P2V Business Development Power User,not in use,dlg.WW.ADM-Services.P2V.BD.power,,,,,"group for ""all BD"" users ? -> script",
P2V Controlling Key User,not in use,dlg.WW.ADM-Services.P2V.CO.key,,,,,,
P2V Controlling Power User,not in use,dlg.WW.ADM-Services.P2V.CO.power,,,,,,
P2V Data ArabEmirates,DATA,dlg.WW.ADM-Services.P2V.data.ARE,data.ArabEmirates,data.ArabEmirates,Data access to country UnitedArabEmirates,,,20
P2V Data Australia,DATA,dlg.WW.ADM-Services.P2V.data.AUS,data.Australia,data.Australia,Data access to country Australia,,,
P2V Data Australia Sapura,DATA,dlg.WW.ADM-Services.P2V.data.AUS.sapura,data.Sapura.Australia,data.Sapura.Australia,Data access to country  Sapura- Australia,,,
P2V Data Austria,DATA,dlg.WW.ADM-Services.P2V.data.AUT,data.Austria,data.Austria,Data access to country Austria,,,
P2V Data Bulgaria,DATA,dlg.WW.ADM-Services.P2V.data.BGR,data.Bulgaria,data.Bulgaria,Data access to country Bulgaria,,,
P2V Data Corporate OMV,DATA,dlg.WW.ADM-Services.P2V.data.corporate,data.Corporate,data.Corporate,Data access to ALL countries,,,
P2V Data Georgia,DATA,dlg.WW.ADM-Services.P2V.data.GEO,data.Georgia,data.Georgia,Data access to country Georgia,,,
P2V Data Kurdistan,DATA,dlg.WW.ADM-Services.P2V.data.KRI,data.Kurdistan,data.Kurdistan,Data access to country Kurdistan,,,
P2V Data Libya,DATA,dlg.WW.ADM-Services.P2V.data.LBY,data.Libya,data.Libya,Data access to country Libya,,,
P2V Data Mexico,DATA,dlg.WW.ADM-Services.P2V.data.MEX,data.Mexico,data.Mexico,Data access to country Mexico,,,
P2V Data Malaysia,DATA,dlg.WW.ADM-Services.P2V.data.MYS,data.Malaysia,data.Malaysia,Data access to country Malaysia,,,
P2V Data Norway,DATA,dlg.WW.ADM-Services.P2V.data.NOR,data.Norway,data.Norway,Data access to country Norway,,,
P2V Data New Zealand,DATA,dlg.WW.ADM-Services.P2V.data.NZL,data.NewZealand,data.NewZealand,Data access to country NewZealand,,,
P2V Data New Zealand Sapura,DATA,dlg.WW.ADM-Services.P2V.data.NZL.sapura,data.Sapura.NewZealand,data.Sapura.NewZealand,Data access to country  Sapura- NewZealand,,,
P2V OMV KZ User,DATA,dlg.WW.ADM-Services.P2V.data.OMVEP,data.OMVEP,data.OMVEP,Data access to ValueCenters,,,
P2V Data Romania,DATA,dlg.WW.ADM-Services.P2V.data.ROU,data.Romania,data.Romania,Data access to country Romania,,,
P2V Data Russia,DATA,dlg.WW.ADM-Services.P2V.data.RUS,data.Russia,data.Russia,Data access to country Russia,,,
P2V OMV Sapura User,???,dlg.WW.ADM-Services.P2V.data.Sapura,,,,,,
P2V Data Tunisia,DATA,dlg.WW.ADM-Services.P2V.data.TUN,data.Tunisia,data.Tunisia,Data access to country Tunisia,,,
P2V Data Yemen,DATA,dlg.WW.ADM-Services.P2V.data.YEM,data.Yemen,data.Yemen,Data access to country Yemen,,,
P2V Developer,SPECIAL,dlg.WW.ADM-Services.P2V.developer,Developer,Developer,internal & external developers,,,
P2V Dataflow Key User,not in use,dlg.WW.ADM-Services.P2V.DF.key,,,,,,
P2V Dataflow Power User,not in use,dlg.WW.ADM-Services.P2V.DF.power,,,,,,
P2V Documents Unlock,SPECIAL,dlg.WW.ADM-Services.P2V.DF.unlock,,,extra permission to unlock DataFlow documents,,,
P2V Economics Key User,not in use,dlg.WW.ADM-Services.P2V.ECO.key,,,,,,
P2V Economics Power User,not in use,dlg.WW.ADM-Services.P2V.ECO.power,,,,,,
P2V Economics Regimes,PROFILE,dlg.WW.ADM-Services.P2V.ECO.regimes,Economics.regimes,A14.profile.Economics.Regimes,Economics Regime Coding,,,
P2V Economics Unlock,SPECIAL,dlg.WW.ADM-Services.P2V.ECO.unlock,Economics.unlock,Economics.unlock,,,,
P2V Exploration Key User,not in use,dlg.WW.ADM-Services.P2V.EX.key,,,,,CAPDAT ?,
P2V Exploration Power User,PROFILE,dlg.WW.ADM-Services.P2V.EX.power,,A25.profile.Exploration.OA.Admin,,,OA-Admin?,
P2V Finance Regimes,PROFILE,dlg.WW.ADM-Services.P2V.FIN.regimes,profile.Finance.Regimes,A17.profile.Finance.Regimes,Financial Regime Coding,,,
P2V Financials Unlock,SPECIAL,dlg.WW.ADM-Services.P2V.FIN.unlock,Financials.unlock,Financials.unlock,,,,
P2V Interface User,???,dlg.WW.ADM-Services.P2V.Interfaces,,,,,,
P2V OData User,PROFILE,dlg.WW.ADM-Services.P2V.Odata,,A03.profile.CAPDAT,Profile for CAPDAT interface users.,,,
P2V OData User,,dlg.WW.ADM-Services.P2V.Odata,,,,,,
P2V Planning & Portfolio Key User,PROFILE,dlg.WW.ADM-Services.P2V.PP.key,profile.Portfolio.Light,A06.profile.Light.Fin.Port,Finance and Portfolio Finance light users (readonly access) DF plus PSE/F/P,,,
P2V Planning & Portfolio Power User,???,dlg.WW.ADM-Services.P2V.PP.power,,,,,,
P2V Headoffice Administrator,not in use,dlg.WW.ADM-Services.P2V.profile.Admin.Headoffice,,,,,,
P2V Headoffice Economist,PROFILE,dlg.WW.ADM-Services.P2V.profile.Economics.Headoffice,profile.Economics.Headoffice,A15.profile.Economics.Plus,Base Economist enhanced with PSE Power and PSE Unlock roles,,,
P2V Local Country Economist,PROFILE,dlg.WW.ADM-Services.P2V.profile.Economics.local,profile.Economics.local,A13.profile.Economics.Classic,Base Economist (includes DF Unlock and Quicklook Admin),,,
P2V Headoffice Controller,PROFILE,dlg.WW.ADM-Services.P2V.profile.Finance.Headoffice,profile.Finance.Headoffice,A18.profile.Finance.Plus,Base Controller enhanced with PSF Power and PSF Unlock roles,,,
P2V Local Country Controller,PROFILE,dlg.WW.ADM-Services.P2V.profile.Finance.local,profile.Finance.local,A16.profile.Finance.Classic,Base Controller,,,
P2V Headoffice Readonly User,PROFILE,dlg.WW.ADM-Services.P2V.profile.LightUser.Headoffice,profile.LightUser.Headoffice,A04.profile.Light,Readonly access DF only (light user),,,
P2V Local Readonly User,,dlg.WW.ADM-Services.P2V.profile.LightUser.local,profile.LightUser.local,XXX.profile.LightUser.local,,,,
P2V Planning Plus,PROFILE,dlg.WW.ADM-Services.P2V.profile.Planning.Plus,,A11.profile.Planning.Plus,Enchanced Dataflow: (includes DF Power role; DF Tab FULL access),,,
P2V Headoffice PP User,PROFILE,dlg.WW.ADM-Services.P2V.profile.PP.Headoffice,profile.PP.Headoffice,A19.profile.Portfolio.Classic,OMV Portfolio role (standard user),,,
P2V Headoffice PP Power User,PROFILE,dlg.WW.ADM-Services.P2V.profile.PP.Headoffice.Power,profile.PP.Headoffice.Power,A26.profile.Portfolio.Plus,,,,
P2V Local Country PP User,PROFILE,dlg.WW.ADM-Services.P2V.profile.PP.local,profile.PP.local,A10.profile.Planning.Classic,Planner (includes DF Unlock),,,
P2V Projectmanager,PROFILE,dlg.WW.ADM-Services.P2V.profile.Projectmanager,profile.Projectmanager,A08.profile.Projectmanager.Classic,"P2V Classic Projectmanager role (data entry & ""full input"" tagging)",,,
P2V Projectmanager LCB,PROFILE,dlg.WW.ADM-Services.P2V.profile.Projectmanager.LCB,,A09.profile.Projectmanager.LCB,LCB Project Manager,,,
P2V Projectmanager Petrom,PROFILE,dlg.WW.ADM-Services.P2V.profile.Projectmanager.PET,profile.Projectmanager.RO,A07.profile.Projectmanager.PET,Read only Project Manager with Input.Confirm tag rights,,,
P2V Headoffice Reserves User,PROFILE,dlg.WW.ADM-Services.P2V.profile.Reserves.Headoffice,profile.Reserves.Headoffice,A21.profile.Reserves.Headoffice,OMV Corporate reserves role (standard user),,,
P2V Reserves Headoffice Approval,PROFILE,dlg.WW.ADM-Services.P2V.profile.Reserves.Headoffice.Approve,profile.Reserves.Headoffice.Approve,A23.profile.Reserves.Headoffice.Approve,special approval role for Headoffice RESERVES ,,,
P2V Headoffice Reserves Power User,PROFILE,dlg.WW.ADM-Services.P2V.profile.Reserves.Headoffice.Power,profile.Reserves.Headoffice.Power,A22.profile.Reserves.Headoffice.Power,OMV Corporate reserves role (power user),,,
P2V Reserves Local Approval,PROFILE,dlg.WW.ADM-Services.P2V.profile.Reserves.local.Approve,profile.Reserves.local.Approve,A27.profile.Reserves.local.Approve,,,,
P2V Local Country QRE,PROFILE,dlg.WW.ADM-Services.P2V.profile.Reserves.local.QRE,profile.Reserves.local.QRE,A20.profile.Reserves.local.QRE,Branch office QRE role,,,
P2V Reserves Readonly,PROFILE,dlg.WW.ADM-Services.P2V.profile.Reserves.readonly,profile.Reserves.readonly,A05.profile.Light.reserves,Reserves readonly role,,,
P2V Headoffice Exploration User,PROFILE,dlg.WW.ADM-Services.P2V.profile.Resources.Headoffice,profile.Resources.Headoffice,A24.profile.Exploration.Assurance,OMV Corporate Exploration Assurance user.  Previously profile.Resources.Headoffice,,,
P2V Local Country Exploration User,,dlg.WW.ADM-Services.P2V.profile.Resources.local,profile.Resources.local,XXX.profile.Resources.local,XXX.profile.Resources.local,,,
P2V Reserves Key User,not in use,dlg.WW.ADM-Services.P2V.RES.key,,,,,,
P2V Reserves Power User,not in use,dlg.WW.ADM-Services.P2V.RES.power,,,,,,
P2V Production Server Admin,SPECIAL,dlg.WW.ADM-Services.P2V.serveradmin,,,system access to serverconfiguration (adminxkey),,,
P2V Test Server Admin,SPECIAL,dlg.WW.ADM-Services.P2V.testserveradmin,,,system access to serverconfiguration (adminxkey),,,
P2V User Admin,SPECIAL,dlg.WW.ADM-Services.P2V.useradmin,User.admin,User.admin,User for useradministration,x,,
PetroVR,PROFILE,dlg.WW.ADM-Services.PetroVR,profile.PetroVR,A02.profile.PetroVR,PetroVR user access to PSE for Headless Calculation. ,,,
,,dlg.WW.ADM-Services.P2V.data.CHE,DATA,,data.Switzerland,,P2V Data Switzerland,
,,dlg.WW.ADM-Services.P2V.data.HRV,DATA,,data.Croatia,,P2V Data Croatia,
,,dlg.WW.ADM-Services.P2V.data.DEU,DATA,,data.Germany,,P2V Data Germany,
,,dlg.WW.ADM-Services.P2V.data.HUN,DATA,,data.Hungary,,P2V Data Hungary,
,,papp.drms.AE.UmmLuluSarb.all,BD,,Z.BD.021,,,
,,papp.drms.AE.GhashaConfidential,BD,,Z.BD.022,,,
,,dlg.WW.ADM-Services.P2V.data.access.PRMS,DATA,,data.access.PRMS.allow,,,
,,dlg.WW.ADM-Services.P2V.data.access.ADJUSTMENT,DATA,,data.access.ADJUST.allow,,,
,,dlg.WW.ADM-Services.P2V.data.access.GAS,DATA,,data.access.GAS.allow,,,
,,dlg.WW.ADM-Services.P2V.data.access.LCB,DATA,,data.access.LCB.allow,,,
